{"schema_version":"rolo-landerpi-rotation-canary/v1","observed_at":"2026-09-06T12:21:43.851680Z","status":"SUCCEEDED","error":null,"motion_started":true,"autonomous_source_confirmed":true,"requested_angle_degrees":5.0,"requested_speed_rad_s":0.1,"duration_limit_s":4.0,"measured_angle_degrees":4.221652084058559,"angle_error_degrees":-0.7783479159414408,"stop_published":true,"stop_attempts":6,"stop_successes":6,"stop_errors":[],"command_attempted":true,"stopped_observed":true,"final_angular_speed_rad_s":-5.623005494955325e-06,"feedback_topic":"/odom","command_topic":"/controller/cmd_vel","motor_topic":"/ros_robot_controller/set_motor","motor_evidence_status":"SUBSCRIBED","motor_subscription_error":null,"motor_sample_count":49,"motor_evidence_kind":"COMMAND_PATH_SAMPLE","motor_is_encoder_feedback":false,"imu_orientation_covariance_status":"UNKNOWN_ALL_ZERO","graph":{"/controller/cmd_vel":{"publisher_count":7,"subscription_count":2,"publisher_nodes":["/hand_gesture","/joystick_control","/lidar_app","/line_following","/object_tracking","/robot_api","/rolo_rotation_canary"],"subscription_nodes":["/odom_publisher","/rolo_rotation_canary"],"publishers":[{"node_name":"robot_api","node_namespace":"/","topic_type":"geometry_msgs/msg/Twist","endpoint_type":"TopicEndpointTypeEnum.PUBLISHER","qos":{"history":3,"depth":0,"reliability":1,"durability":2,"lifespan":"Infinite","deadline":"Infinite","liveliness":1}},{"node_name":"lidar_app","node_namespace":"/","topic_type":"geometry_msgs/msg/Twist","endpoint_type":"TopicEndpointTypeEnum.PUBLISHER","qos":{"history":3,"depth":0,"reliability":1,"durability":2,"lifespan":"Infinite","deadline":"Infinite","liveliness":1}},{"node_name":"line_following","node_namespace":"/","topic_type":"geometry_msgs/msg/Twist","endpoint_type":"TopicEndpointTypeEnum.PUBLISHER","qos":{"history":3,"depth":0,"reliability":1,"durability":2,"lifespan":"Infinite","deadline":"Infinite","liveliness":1}},{"node_name":"object_tracking","node_namespace":"/","topic_type":"geometry_msgs/msg/Twist","endpoint_type":"TopicEndpointTypeEnum.PUBLISHER","qos":{"history":3,"depth":0,"reliability":1,"durability":2,"lifespan":"Infinite","deadline":"Infinite","liveliness":1}},{"node_name":"hand_gesture","node_namespace":"/","topic_type":"geometry_msgs/msg/Twist","endpoint_type":"TopicEndpointTypeEnum.PUBLISHER","qos":{"history":3,"depth":0,"reliability":1,"durability":2,"lifespan":"Infinite","deadline":"Infinite","liveliness":1}},{"node_name":"joystick_control","node_namespace":"/","topic_type":"geometry_msgs/msg/Twist","endpoint_type":"TopicEndpointTypeEnum.PUBLISHER","qos":{"history":3,"depth":0,"reliability":1,"durability":2,"lifespan":"Infinite","deadline":"Infinite","liveliness":1}},{"node_name":"rolo_rotation_canary","node_namespace":"/","topic_type":"geometry_msgs/msg/Twist","endpoint_type":"TopicEndpointTypeEnum.PUBLISHER","qos":{"history":3,"depth":0,"reliability":1,"durability":2,"lifespan":"Infinite","deadline":"Infinite","liveliness":1}}],"subscriptions":[{"node_name":"odom_publisher","node_namespace":"/","topic_type":"geometry_msgs/msg/Twist","endpoint_type":"TopicEndpointTypeEnum.SUBSCRIPTION","qos":{"history":3,"depth":0,"reliability":1,"durability":2,"lifespan":"Infinite","deadline":"Infinite","liveliness":1}},{"node_name":"rolo_rotation_canary","node_namespace":"/","topic_type":"geometry_msgs/msg/Twist","endpoint_type":"TopicEndpointTypeEnum.SUBSCRIPTION","qos":{"history":3,"depth":0,"reliability":2,"durability":2,"lifespan":"Infinite","deadline":"Infinite","liveliness":1}}]},"/odom_raw":{"publisher_count":1,"subscription_count":2,"publisher_nodes":["/odom_publisher"],"subscription_nodes":["/ekf_filter_node","/rolo_rotation_canary"],"publishers":[{"node_name":"odom_publisher","node_namespace":"/","topic_type":"nav_msgs/msg/Odometry","endpoint_type":"TopicEndpointTypeEnum.PUBLISHER","qos":{"history":3,"depth":0,"reliability":1,"durability":2,"lifespan":"Infinite","deadline":"Infinite","liveliness":1}}],"subscriptions":[{"node_name":"ekf_filter_node","node_namespace":"/","topic_type":"nav_msgs/msg/Odometry","endpoint_type":"TopicEndpointTypeEnum.SUBSCRIPTION","qos":{"history":3,"depth":0,"reliability":2,"durability":2,"lifespan":"Infinite","deadline":"Infinite","liveliness":1}},{"node_name":"rolo_rotation_canary","node_namespace":"/","topic_type":"nav_msgs/msg/Odometry","endpoint_type":"TopicEndpointTypeEnum.SUBSCRIPTION","qos":{"history":3,"depth":0,"reliability":2,"durability":2,"lifespan":"Infinite","deadline":"Infinite","liveliness":1}}]},"/odom":{"publisher_count":1,"subscription_count":2,"publisher_nodes":["/ekf_filter_node"],"subscription_nodes":["/robot_api","/rolo_rotation_canary"],"publishers":[{"node_name":"ekf_filter_node","node_namespace":"/","topic_type":"nav_msgs/msg/Odometry","endpoint_type":"TopicEndpointTypeEnum.PUBLISHER","qos":{"history":3,"depth":0,"reliability":1,"durability":2,"lifespan":"Infinite","deadline":"Infinite","liveliness":1}}],"subscriptions":[{"node_name":"robot_api","node_namespace":"/","topic_type":"nav_msgs/msg/Odometry","endpoint_type":"TopicEndpointTypeEnum.SUBSCRIPTION","qos":{"history":3,"depth":0,"reliability":1,"durability":2,"lifespan":"Infinite","deadline":"Infinite","liveliness":1}},{"node_name":"rolo_rotation_canary","node_namespace":"/","topic_type":"nav_msgs/msg/Odometry","endpoint_type":"TopicEndpointTypeEnum.SUBSCRIPTION","qos":{"history":3,"depth":0,"reliability":2,"durability":2,"lifespan":"Infinite","deadline":"Infinite","liveliness":1}}]},"/imu":{"publisher_count":1,"subscription_count":2,"publisher_nodes":["/imu_filter"],"subscription_nodes":["/ekf_filter_node","/rolo_rotation_canary"],"publishers":[{"node_name":"imu_filter","node_namespace":"/","topic_type":"sensor_msgs/msg/Imu","endpoint_type":"TopicEndpointTypeEnum.PUBLISHER","qos":{"history":3,"depth":0,"reliability":1,"durability":2,"lifespan":"Infinite","deadline":"Infinite","liveliness":1}}],"subscriptions":[{"node_name":"ekf_filter_node","node_namespace":"/","topic_type":"sensor_msgs/msg/Imu","endpoint_type":"TopicEndpointTypeEnum.SUBSCRIPTION","qos":{"history":3,"depth":0,"reliability":2,"durability":2,"lifespan":"Infinite","deadline":"Infinite","liveliness":1}},{"node_name":"rolo_rotation_canary","node_namespace":"/","topic_type":"sensor_msgs/msg/Imu","endpoint_type":"TopicEndpointTypeEnum.SUBSCRIPTION","qos":{"history":3,"depth":0,"reliability":2,"durability":2,"lifespan":"Infinite","deadline":"Infinite","liveliness":1}}]},"/ros_robot_controller/set_motor":{"publisher_count":2,"subscription_count":2,"publisher_nodes":["/hand_gesture","/odom_publisher"],"subscription_nodes":["/rolo_rotation_canary","/ros_robot_controller"],"publishers":[{"node_name":"odom_publisher","node_namespace":"/","topic_type":"ros_robot_controller_msgs/msg/MotorsState","endpoint_type":"TopicEndpointTypeEnum.PUBLISHER","qos":{"history":3,"depth":0,"reliability":1,"durability":2,"lifespan":"Infinite","deadline":"Infinite","liveliness":1}},{"node_name":"hand_gesture","node_namespace":"/","topic_type":"ros_robot_controller_msgs/msg/MotorsState","endpoint_type":"TopicEndpointTypeEnum.PUBLISHER","qos":{"history":3,"depth":0,"reliability":1,"durability":2,"lifespan":"Infinite","deadline":"Infinite","liveliness":1}}],"subscriptions":[{"node_name":"ros_robot_controller","node_namespace":"/","topic_type":"ros_robot_controller_msgs/msg/MotorsState","endpoint_type":"TopicEndpointTypeEnum.SUBSCRIPTION","qos":{"history":3,"depth":0,"reliability":1,"durability":2,"lifespan":"Infinite","deadline":"Infinite","liveliness":1}},{"node_name":"rolo_rotation_canary","node_namespace":"/","topic_type":"ros_robot_controller_msgs/msg/MotorsState","endpoint_type":"TopicEndpointTypeEnum.SUBSCRIPTION","qos":{"history":3,"depth":0,"reliability":2,"durability":2,"lifespan":"Infinite","deadline":"Infinite","liveliness":1}}]}},"nodes":["/LD19","/_web_video_server","/ar_app","/arm_controller","/aurora/aurora","/controller_manager","/ekf_filter_node","/gripper_controller","/hand_gesture","/hand_trajectory","/imu_calib","/imu_filter","/init_pose","/joint_state_publisher","/joy_node","/joystick_control","/lidar_app","/line_following","/object_tracking","/odom_publisher","/robot_api","/robot_state_publisher","/rolo_rotation_canary","/ros_robot_controller","/rosapi","/rosapi_params","/rosbridge_websocket","/scan_to_scan_filter_chain","/servo_manager","/static_transform_publisher_F4tQ16KTYsRS5DfJ","/transform_listener_impl_555639596ea0","/web_video_server"],"sample_records":{"cmd_vel":[{"t":1.195352136004658,"header_stamp_s":null,"angular_z":0.1,"linear_x":0.0,"linear_y":0.0},{"t":1.2506744430065737,"header_stamp_s":null,"angular_z":0.1,"linear_x":0.0,"linear_y":0.0},{"t":1.3007146070012823,"header_stamp_s":null,"angular_z":0.1,"linear_x":0.0,"linear_y":0.0},{"t":1.351697881000291,"header_stamp_s":null,"angular_z":0.1,"linear_x":0.0,"linear_y":0.0},{"t":1.4036729880026542,"header_stamp_s":null,"angular_z":0.1,"linear_x":0.0,"linear_y":0.0},{"t":1.4552825950013357,"header_stamp_s":null,"angular_z":0.1,"linear_x":0.0,"linear_y":0.0},{"t":1.5071670160032227,"header_stamp_s":null,"angular_z":0.1,"linear_x":0.0,"linear_y":0.0},{"t":1.5589024750006502,"header_stamp_s":null,"angular_z":0.1,"linear_x":0.0,"linear_y":0.0},{"t":1.6182940380022046,"header_stamp_s":null,"angular_z":0.1,"linear_x":0.0,"linear_y":0.0},{"t":1.6717385690062656,"header_stamp_s":null,"angular_z":0.1,"linear_x":0.0,"linear_y":0.0},{"t":1.7237357690028148,"header_stamp_s":null,"angular_z":0.1,"linear_x":0.0,"linear_y":0.0},{"t":1.7739115990043501,"header_stamp_s":null,"angular_z":0.1,"linear_x":0.0,"linear_y":0.0},{"t":1.8247638540051412,"header_stamp_s":null,"angular_z":0.1,"linear_x":0.0,"linear_y":0.0},{"t":1.8855174540003645,"header_stamp_s":null,"angular_z":0.1,"linear_x":0.0,"linear_y":0.0},{"t":1.9391857630034792,"header_stamp_s":null,"angular_z":0.1,"linear_x":0.0,"linear_y":0.0},{"t":1.9910022960029892,"header_stamp_s":null,"angular_z":0.1,"linear_x":0.0,"linear_y":0.0},{"t":2.04123101500